,content
38,"안녕하세요 모던 자바스크립트 딥다이브 함께 읽을 스터디원을 모집합니다.정해진 분량을 읽고 정리하며 자바스크립트 지식을 체화하는 것을 목표로 하고 있습니다. 취준이나 이직 준비중이신 분들 환영합니다. - 모집 대상: 기초 자바스크립트 지식이 있고 프론트엔드 취준생 또는 재직중인 사람- 모집 인원: 4~5명- 진행 기간: 2/1 - 4/18 (11주)- 진행 시간/장소: 매주 목요일 21:30 게더타운- 진행 방식: 매주 정한 일정대로 공부한 내용 정리한것 공유- 공부할 챕터: 1~12, 16, 20, 43.3, 46을 제외한 모든 챕터- 깃헙 레포에서 진행 예정 주차별 진도와 진행 방식과 규칙을 러프하게 생각해두긴했는데 1/25나 2/1에 다같이 구체적으로 정해볼 생각입니다. 오픈 채팅으로 github주소와 간단한 본인 소개(전공/취준기간/이직 준비 여부/프론트엔드 개발 경력 등등)를 자유롭게 남겨주세요. 자신을 표현할 다른 수단들도 환영합니다.(ex. 블로그) -마감-"
39,"나만의 독보적인 포트폴리오를 만들고 싶다면?단기간에 프로젝트 A to Z를 경험하고 싶다면?타 직군과 소통하며 협업을 경험하고 싶다면? 위와 같은 고민을 하고 있다면 지금 당장 ‘스위프 3’기에 지원하세요!완벽하게 취.뽀. 하고 싶은 대학생&취준생&주니어 모두 환영! (비전공자도 환영🙌) 📢 [스위프란?]스위프는 기획자, 디자이너, 개발자가 한 팀으로 웹개발 단기 프로젝트(6주)를 경험하고 성장할 수 있는 기회를 제공합니다! 스위프를 통해 나와 맞는 팀원과 함께 프로젝트의 전 과정을 경험하고, 나만의 차별화 된 포트폴리오를 만들 수 있어요! ⭐ [참가 혜택]1. 체계적으로 협업할 수 있도록 스위프 전용 협업 툴 지원!2. 초보자도 쉽게 프로젝트를 진행할 수 있는 가이드라인 및 템플릿 제공!3. 복잡한 과정 없이 GitHub 연동만으로 쉽고 빠른 웹 호스팅 지원!4. 포트폴리오로 활용할 수 있도록 프로젝트 결과물 보존!→ 자세히 알아보기 https://swyg.oopy.io/swyp/benefit 🙌🏻 [모집 대상]- 아이디어 기획 경험이 한 번이라도 있는 기획자,디자인 툴 하나라도 사용해 본 디자이너,프로그래밍 언어를 하나라도 공부해 본 개발자, 모두 환영해요!- 한 번도 사이드 프로젝트 해본 적 ‘없’는 사람? 오히려 좋아요!- 경험이 부족해도 포트폴리오가 없어도 괜찮아요. 당신의 의지와 열정이면 충분해요! 🔥 [참가비]- “단돈 69,000원!”참가비 169,000원 (정가 250,000원)수료 시 현금 리워드(10만원) 증정 📅 [일정]- 지원 마감 : 1/21(일)- 합격자 안내 : 1/22(월) 20:00- 팀 빌딩 : 1/23(화)~1/25(목)- 킥오프 미팅 : 1/27(토) 10:00- 프로젝트 시작 : 1/29(월)- 프로젝트 발표 및 네트워킹 행사 : 2024/3/23(토)※ 세부 일정은 합격자에 한해 일괄 안내 예정 📌 [지원 방법]신청서 작성 https://swyp.softr.app 🙋 [문의]Contact : https://open.kakao.com/o/sgTUNmUdEmail : shlee@swyg.im 👉 스위그(SWYG)에 대해 더 알고 싶다면?홈페이지 https://www.swygbro.com인스타그램 https://www.instagram.com/swyg_official"
40,"‘스닙팟’은 관심사를 팔로우 하는 서비스로, 관심사 해시태그를 팔로우하면 블로그, 유튜브, 매거진, 뉴스 등 인터넷 모든 곳의 정보를 한 곳에서 모아 보실 수 있는 서비스 입니다.특히 기술, 인공지능, 스타트업 분야에 관심있는 분들께 서비스를 더 많이 알리고자 스터디 모임을 후원하게 되었습니다. 대관료, 음료값 등 스터디 진행 비용을 지원하려고 합니다. 아래 탈리폼 링크를 통해 신청해주세요! :) ◾ 대상IT/테크, 개발, 인공지능 분야의 최소 인원 4명 이상인 스터디 모임, 오프라인 한정 ◾지원 내용최대 10만원 상당의 스터디 지원금 ◾모집 기간게시일~ 1월 29일 마감 ◾신청 방법모임장이 탈리폼 통해 신청선정된 스터디 모임에 한하여 자세한 내용의 안내 메일이 발송될 예정입니다.신청서 링크 : 스터디 모임 지원 신청서(혹시) 스닙팟이 궁금하시다면? 스닙팟은 이렇게 활용하실수 있어요!하나, 새로운 정보를 한 곳에서 모아 볼 수 있어요.#인공지능, #테크뉴스 팔로우하고 매일 모이는 새로운 정보들, 마이피드에서 하루 5분 쓱 훑어 볼 수 있습니다. 기술 트렌드, 실리콘밸리 소식 여기저기 찾아다니지 않고 스닙팟에서 한번에 편하게! 둘, 누구나 생성할 수 있는 해시태그 #팟 을 생성해 우리 모임원끼리 레퍼런스 공유하기.URL만 있으면 어떤 정보도 공유할 수 있어요. 스닙팟 서비스 더 알아보기(링크)스닙팟은 어떤 서비스 인가요?"
41,🚀 자바 스프링 2개월 과정 수업 🚀안녕하세요! 자바 스프링 현업 개발자 기초부터 실무까지 수업 진행합니다.✨ 수업 내용:-자바 기초: 자바 문법과 객체지향 프로그래밍 기초를 탄탄히 학습합니다.-스프링 프레임워크: 현업에서 사용되는 스프링 프레임워크를 기초부터 학습합니다.-데이터베이스 연동: 스프링과 데이터베이스 연동에 대한 이해를 통해 실무에서 필요한 데이터 관리 기술을 습득합니다.💡 대상: -자바 프로그래밍에 관심 있으신 분-웹 개발에 도전하고자 하시는 분-스프링 프레임워크 실무 경험을 쌓고 싶은 분📅 일정 및 장소:기간: 2개월수업 시간: 주 2회 4시간 16회차 수업🎓 수업 특징:현업 개발자 강의 + 멘토링 + 수업 관리 실무에서 활용 가능한 실전 경험을 공유합니다.📝 수강 문의: https://open.kakao.com/o/so4IVj4f
42,"스터디원 두분이 취업하셔서 충원합니다 홍입 셀스 스터디카페 매주 금요일 17시 3:1 면접으로 진행하게 됩니다 기본적인 CS지식과 중도포기 없으신 분들만 지원해주세요 (취업으로 인한 하차는 언제든지 축하입니다) https://github.com/JaeYeopHan/Interview_Question_for_Beginner위 깃헙에서 범위 정한 후 그 주제에 대해 공부해와서 면접으로 진행하는 방식입니다 (매주 3~4 주제)면접 전 기본적으로 한번 CS 공부내용 복기하면서 서로 의견주고받은 후에 진행하게 됩니다매주 수요일 스터디룸 비용 4000원, 공통질문 2개 이상 올린 후 질문에 대한 꼬리질문들도 공부해오게 됩니다이번주는 네트워크입니다 (현재 db, 운영체제는 완료했습니다)2분 모집하겠습니다 (현재 2명) https://open.kakao.com/o/szoocs4f간단한 자기소개 부탁드립니다!"
43,✨ 우선 해당 글은 스터디를 모집하는 글이 아님을 밝힙니다.[스터디 활용 저장소 소개]안녕하세요.코딩 테스트 문제를 푸는 것에 대해서 오늘 조금 이야기 해볼까 합니다. 1. 내가 풀었지만 어떻게 풀었는지 전혀 기억이 나지 않나요?2. 문제별로 블로그에 정리는 했는데 블로그가 너무 문제풀이만 가득하지 않나요?3. 문제는 프로그래머스에서 풀고.. 정리는 블로그에 정리하는게 비효율적이지 않나요?4. 나랑 같은 문제를 푼 사람의 코드뿐만 아니라 어떤 생각으로 풀었는지 알고 싶지 않나요? 그래서 생각한데로 저장소를 조금 더 개선 해보았습니다.PR 샘플 링크 1. 기존의 테스트 PR 단위를 챕터 단위에서 하나의 문제로 변경2. 하나의 문제를 PR 로 기록할 수 있게 탬플릿을 제공3. 커밋과 코멘트를 스스로 달면서 풀이과정 까지 기록할 수 있는 자신만의 오답노트를!4. 같은 문제를 다른 사람은 어떤 생각으로 풀었을까? -> 라벨링으로 찾아보고!5. 다른 사람의 코드에 직접 질문을 남겨보고 피드벡도 받아보고!6. 도움이 필요한 사람에게 도움을 주면서 성장해보세요! 책과 해당 저장소가 도움이 되지 않을까 해 같아서 글을 남깁니다.감사합니다. 책 링크저장소 링크
44,"[개발 스터디 모집 내용 예시]스터디 주제 : 이펙티브 코틀린 스터디스터디 목표 : 이펙티브 코틀린 완벽 이해예상 스터디 일정(횟수)기간 : 10주횟수 : 주 1회진행 시간 : 1시간 ~ 2시간예상 커리큘럼 간략히매주 5개 ~ 6개 정도의 아이템을 순서대로 읽고, 본인이 원하는 곳 (notion, github 등)에 정리구글 meet, discord, zoom 등 원하는 플랫폼에서 온라인 진행매주 돌아가면서 발표 진행발표내용에 대한 질문 및 보충기타 공유하고싶은 내용 공유예상 모집인원5명 스터디 관련 주의사항이펙티브 코틀린은 난이도가 어느정도 있어서 아예 코틀린을 모르면 힘들 것 같습니다.10주 동안 꾸준히 참여하실 수 있는 분이시면 좋을 것 같습니다.제가 회사원이라 회사에 다니시는분이면 좋겠습니다. (꼭 아니어도 됩니다 !)스터디에 지원할 수 있는 방법을 남겨주세요."
45,"국비나 독학하시는 분들, 함께 공부하면서 정보 공유,취업준비 하실 분들 모십니다.현재 저 포함 4명 진행중입니다. 인원제한은 없습니다.구월동에서 화목 3-6시에 off 있습니다.모각코가 기본이며 CS 주1회 발표하고 더하여 알고리즘도 진행할 예정입니다. 스택은 무관하므로 자유롭게 참여 가능합니다.카톡 qr입니다 연락주세요:)"
46,[ 자바 스프링 2개월 과정 수업 ]안녕하세요~ 자바 스프링 현업 개발자 기초부터 실무까지 수업 진행합니다. 🐬 수업 내용:-자바 기초: 자바 문법과 객체지향 프로그래밍 기초를 탄탄히 학습합니다.-스프링 프레임워크:  실무에서 사용되는 스프링 프레임워크를 기초부터 학습합니다.-데이터베이스 연동: 스프링과 데이터베이스 연동에 대한 이해를 통해 실무에서 필요한 데이터 관리 기술을 습득합니다. 🐬 대상: -자바 프로그래밍에 관심 있으신 분-웹 개발에 도전하고자 하시는 분-스프링 프레임워크 실무 경험을 쌓고 싶은 분 🐬일정 및 장소:-기간: 2개월-수업 시간: 주 2회 4시간 16회차 수업🐬수업 특징:-현업 개발자 강의 + 멘토링 + 수업 관리 -실무에서 활용 가능한 실전 경험을 공유합니다. 🐬수강 문의: https://open.kakao.com/o/so4IVj4f
47,"[개발 스터디 모집 내용 예시]스터디 주제 : 알고리즘 스터디예상 스터디 일정(횟수) : 10주간 주제에 따른 문제 선정과 풀이 예상 모집인원 : 1명 (현재 5명)스터디 소개와 개설 이유 : 최소한의 강제성 및 동기부여스터디에 지원할 수 있는 방법을 남겨주세요. (이메일, 카카오 오픈채팅방, 구글폼 등.) :https://open.kakao.com/o/sDzQXTYf10주간 꾸준히 같이 알고리즘 스터디를 하실분을 모집합니다.12월 27일이 4번째 세션의 마지막 주이고, 같은날 27일부터 5번째 세션을 시작할 예정입니다.한분이 취업으로 인해 더 이상 참여가 어려워서 한분 추가 모집합니다.(현재는 4주차 진행중이고, 해당 주차 주제는 트리입니다) 매주:주제에 맞는 문제를 각자 선정해서 총 10~15문제 /n으로 깃허브 이슈 등록(3명이면 5문제씩, 4명이면 4문제씩).백준/리트코드/프로그래머스 알고리즘 문제들만 주제에 맞게 자율적으로 선택문제 선정 난이도는 최소 백준-실버 이상, 프로그래머스 레벨2 이상입니다.본인 기준 무난하게 풀 수 있을 정도부터 도전해보고 싶은 문제까지 제한은 없습니다.다만 인터넷에 해설도 안나와있는 정말 말도 안되는 난이도의 문제는 안됩니다. ㅎㅎ; 문제 풀이 또한 깃허브에서 본인 branch를 만들고, pull request를 하는 방식입니다.문제를 모두 풀지 못하더라도 괜찮습니다. 절반도 못풀어도 괜찮습니다. 하지만 정도가 심하고 반복되면, 계속할 의사가 없는걸로 간주하고 탈퇴처리됩니다. 언어는 자바 또는 파이썬을 사용합니다. 본인 정답 코드 상단에 간단한 풀이, 시간복잡도, 사용한 자료구조를 작성합니다. 매주 수요일 19:30부터 30분~씩 리뷰. (최대 1시간반 칼)리뷰 방식은 간단 풀이 설명 또는 접근 방식 설명 정도입니다. (음성으로 소통)리뷰는 온라인으로, 참여는 자유이며 강제성이 없습니다.리뷰 후에는 다음 주제에 대한 문제들을 바로 등록합니다.스터디의 목적은 오로지 최소한의 강제성과 서로간의 동기부여를 목적으로 하므로, 오프라인 부담, 감독, 관리, 간섭이 거의 없으며, 인프런에 타 스터디들과 비교했을때 비교적 자유롭습니다. (다만, 다른 참여자들을 위해 매주 문제들은 필수로 등록해야합니다.)"
48,"[개발 스터디 모집 내용 예시]스터디 주제 : 자바 스터디 스터디 목표 :'실전 자바-기본편'을 2월까지 함께 수강하고자 하는 분들을 모집합니다. 예상 스터디 일정(횟수) :주 1회 수요일 오전 10시부터 12시 (정오) (온라인) 예상 커리큘럼 간략히 :https://moonxxpower.notion.site/fbd392d5f3aa443ebe835bd737e00c6d?pvs=4(기존 스터디원과 '김영한의 자바 입문'을 수강한 상태입니다.)예상 모집인원 :현재 저 포함 3분 있어서 1-3분 정도 더 모집하려고 합니다. (최대 6명으로) 스터디 소개와 개설 이유 :자바를 제대로 모른 상태에서 스프링 프로젝트를 진행하였더니 기초가 많이 부족한 느낌이 들어 자바를 다시 공부하려고 하는데, 아무래도 혼자 공부하는 것보다는 함께 공부하는 것이 좋을 것 같아 스터디를 모집합니다! 추후 김영한님 강의를 통해 스프링 강의 스터디도 진행하면 좋을 것 같아요. 병행해도 좋구요! 짧은 시간에 진행하는 스터디인만큼 2월까지의 스터디에 충분히 참여 가능하신 분들을 모집합니다!또한, 책임감 있는 스터디 진행을 위해 보증금 (1만원에서 최대 3만원 사이) 제도를 도입할 예정입니다. 거주 지역 (수도권, 서울 등 대략적인 위치만 말씀해주셔도 됩니다.) 현재 하는 일 (충분한 스터디 참여 가능 여부를 확인하기 위한 목적입니다.)스터디 참여 이유해당 내용을 포함하여 오픈 채팅 남겨주세요:)https://open.kakao.com/o/sbRcIg4f"
49,"🚀 프론트엔드 수업 - 프론트 기초개념부터 리액트까지(4개월)+포트폴리오, 면접관리(2개월) 🚀안녕하세요!HTML, CSS, 자바스크립트, 리액트 + 포트폴리오, 면접관리(2개월) 수업합니다.✨ 강의 내용:-HTML & CSS : 웹 페이지 기본 구조와 스타일링의 기초를 배웁니다.-자바스크립트: 동적이고 인터랙티브한 웹을 위해 자바스크립트를 배우고, 프로젝트에 활용을 해볼수 있습니다.-리액트 프레임워크: 프론트엔드 취업시장에서 많이 쓰이는 리엑트 기본 개념부터 실습까지 배울수 있습니다.💡 이런 분들에게 추천합니다:-웹 개발에 대한 기본을 탄탄히 다지고 싶은 분들-현업에서 사용되는 기술 스택을 배워보고 싶은 분들-프론트엔드 개발자로 취업 또는 실력 향상을 목표로 하는 분들-학원을 다녔지만 개념이 안잡혀 있으신 분들📅 수업 일정 :-주2회 4시간 온라인(Zoom) 수업 (상황에 따라 시간 조절 가능)📝 문의 : https://open.kakao.com/o/saRXUg4f"
50,"고급 영어 시사/경제 주간지를 통한 온라인 토론 스터디로 다양한 분야의 토픽을 통해 깊이있고 수준높은 영어 스피킹 능력을 키우는 것을 목표로 하는 분들을 모집합니다미국, 유럽과 한국에서 조인해 주셨고 인원이 채워지면 바로 글을 내리도록 하겠습니다.아래와 같은 분들이면 참여가 가능합니다. - 고급 수준의 영어스피킹이 가능한분들 - 일상영어 수준이 아닌 특정분야에 대해 깊이있게 이야기하고 전문분야가 아니더라도 다양한 분야에 관심을 가지고 영어로 자신의 생각을 표현하고 싶은분들  - 비판적인 사고 능력을 키우고 주제에 관한 이해를 통해 자신감을 얻고자 하는 분들- 고급스러운 영어를 사용하는 분들과의 교류를 통해 좀더 업그레이드가 필요하다고 느끼시는 분들. 토요일 저녁 10시에 운영중입니다.가능하면 자신의 영어스피킹 정도및 관심분야를 아래 메일로 보내주시면 연락드리겠습니다. (나이, 성별은 보내지 마시길)seanktx2002@protonmail.com."
51,"🚗 프로젝트 소개강아지 산책 알바 플랫폼입니다.반려인은 산책 알바생이 자신의 강아지와 함께하는 이동 경로를 실시간으로 확인 가능합니다. 이로 인해 반려인은 강아지의 안전과 알바생의 책임성을 보다 확실하게 체크할 수 있어, 안심하고 서비스를 이용할 수 있습니다.자세한 프로젝트 설명은 팀이 꾸려질 시 설명드리도록 하겠습니다! 👥 모집 분야 및 인원- 프론트엔드 개발자: 2~3명 👥 현재 팀 인원- 백앤드 개발자 2명 💻 이런 분들을 찾습니다- 부산에서 오프라인 모임 가능하신분(중요)- 개발 공부를 하며 포트폴리오를 만들고 싶은 분- 프로젝트를 진행하며 의견 공유에 적극적이신분- 팀원의 의견을 잘 수용하여 배우려는 자세를 지니신분 📅 지원 방법rlarkddnr1686@naver.com위의 이메일로 아래 4가지 사항을 적어 제출하시면 됩니다!!성함 / 나이 / 본인 소개(개발 경력 또는 공부기간 / 사용하는 언어 및 프레임워크 소개) / 질문사항많은 지원 바랄게요!"
52,"함께 인공지능 공부할 스터디 팀원을 모집합니다![주제 및 목표]주제: 인공지능(머신러닝, 딥러닝)목표: 인공지능(빅데이터) 업무 능력 향상 도움, 빅데이터 처리 실습, 사이드 프로젝트[일정 및 장소]주 1 회(월요일 퇴근 후 7~9시) 오프라인 스터디, 강남[커리큘럼 및 모집 인원]커리큘럼 인공지능(머신러닝, 딥러닝, 빅데이터) 관련 사이드 프로젝트 선정 후 작업빅데이터 분석 기사, SQLD 등 각종 자격증 공부(예정) 인프런 혹은 패스트 캠프 강의를 개별 등록 후 수강모집인원: 1 명 (현재 5명 스터디 진행 중, SW 엔지니어 1명, 빅데이터 엔지니어 4명)[모집 대상]인공지능(빅데이터)에 진심이면서 어느 정도 인공지능 및 빅데이터 처리 관련 지식이 있는 분업무에 인공지능(빅데이터)을 사용하는데 추가적 공부 혹은 사이드 프로젝트 수행이 필요하신 분인공지능(빅데이터)관련 자격증 취득이 필요하신 분[지원 방법]오픈카톡(https://open.kakao.com/o/sohc0GSf)으로 간단한 자기소개와 함께 신청 부탁드립니다지난 3개월동안 매주 월요일마다 한주간 머신러닝 공부한 내용을 정리해서 발표하는 시간을 갖었습니다. 이제부터는 인공지능관련 주제를 정하고 프로젝트를 기획해서 진행해보려고 합니다. 관심있으신 분 연락주시면 상세히 설명드리겠습니다감사합니다"
53,"[개발 스터디 모집 내용 예시]스터디 주제:김영한 spring 로드맵 & JPA 로드맵 전 커리큘럼 같이 스터디하실분 모집합니다.스터디 목표: 꾸준히 커리큘럼 따라가며 빠르게 복습하여 실력을 쌓기.예상 스터디 일정(횟수): 평일1회 주말 1회 오프라인으로 모여서 3일동안 공부한내용 돌아가면서 설명하고 서로모르는건 같이 알아보기.예상 커리큘럼 간략히: 3일공부하고 하루 발표하는식으로 빠른스탭으로 김영한님 커리큘럼강의를 끝낼예정입니다예상 모집인원: 3~4명스터디 소개와 개설 이유 :혼자 공부하면 막히는부분에서 시간이 오래 끌리는데 이런부분을 스터디원분들과 집단지성으로 해결해나아가면서 빠르게 커리돌리고 이후에 필요한 공부를 더해서 좋은 포토폴리오를 만들어 공부이력을 쌓고 취업까지 열심히 준비하는 개발자분들을 미리미리 주니어때부터 알아가고싶습니다.스터디 관련 주의사항 : 김영한 자바 강의 2개 수강하신분들만 와주셨으면좋겠습니다( 아니면 JAVA를 어느정도알고계신분)스터디에 지원할 수 있는 방법을 남겨주세요. (이메일, 카카오 오픈채팅방, 구글폼 등.)https://open.kakao.com/o/gTPi7Y1f소개: 국비지원 풀스택 과정을 11월에 마친 취준생입니다. 많이 부족하고 다른사람 알려줄 실력은 안되지만같이 모여서 공부하고 정보교환하고자하는 환경을 만들고 싶었습니다. 이런 초보 스터디가 잘안열려서 직접열었습니다.조금 실력있는 분들이 오셔도 좋지만 막히는 부분에서 서로 열심히 서칭하고 공부해갔으면 좋겠습니다!감사합니다"
54,"나만의 독보적인 포트폴리오를 만들고 싶다면?단기간에 프로젝트 A to Z를 경험하고 싶다면?타 직군과 소통하며 협업을 경험하고 싶다면? 위와 같은 고민을 하고 있다면 지금 당장 ‘스위프 3’기에 지원하세요!완벽하게 취.뽀. 하고 싶은 대학생&취준생&주니어 모두 환영! (비전공자도 환영🙌) 📢 [스위프란?]스위프는 기획자, 디자이너, 개발자가 한 팀으로 웹개발 단기 프로젝트(6주)를 경험하고 성장할 수 있는 기회를 제공합니다! 스위프를 통해 나와 맞는 팀원과 함께 프로젝트의 전 과정을 경험하고, 나만의 차별화 된 포트폴리오를 만들 수 있어요! ⭐ [참가 혜택]1. 체계적으로 협업할 수 있도록 스위프 전용 협업 툴 지원!2. 초보자도 쉽게 프로젝트를 진행할 수 있는 가이드라인 및 템플릿 제공!3. 복잡한 과정 없이 GitHub 연동만으로 쉽고 빠른 웹 호스팅 지원!4. 포트폴리오로 활용할 수 있도록 프로젝트 결과물 보존!→ 자세히 알아보기 https://swyg.oopy.io/swyp/benefit 🙌🏻 [모집 대상]- 아이디어 기획 경험이 한 번이라도 있는 기획자,디자인 툴 하나라도 사용해 본 디자이너,프로그래밍 언어를 하나라도 공부해 본 개발자, 모두 환영해요!- 한 번도 사이드 프로젝트 해본 적 ‘없’는 사람? 오히려 좋아요!- 경험이 부족해도 포트폴리오가 없어도 괜찮아요. 당신의 의지와 열정이면 충분해요! 🔥 [참가비]- “단돈 69,000원!”참가비 169,000원 (정가 250,000원)수료 시 현금 리워드(10만원) 증정 📅 [일정]- 지원 마감 : 1/21(일)- 합격자 안내 : 1/22(월) 20:00- 팀 빌딩 : 1/23(화)~1/25(목)- 킥오프 미팅 : 1/27(토) 10:00- 프로젝트 시작 : 1/29(월)- 프로젝트 발표 및 네트워킹 행사 : 2024/3/23(토)※ 세부 일정은 합격자에 한해 일괄 안내 예정 📌 [지원 방법]신청서 작성 https://swyp.softr.app 🙋 [문의]Contact : https://open.kakao.com/o/sgTUNmUdEmail : shlee@swyg.im 👉 스위그(SWYG)에 대해 더 알고 싶다면?홈페이지 https://www.swygbro.com인스타그램 https://www.instagram.com/swyg_official"
55,"[개발 스터디 모집 내용 예시]스터디 주제 : Javascript 핵심 공부, React 기초스터디 목표 : Javascript 및 React 기본 다지기예상 스터디 일정(횟수) : 주 1 - 2 회 (1시간 - 2시간)예상 커리큘럼 간략히 : Javascript Deep Dive 책 기준으로 핵심 내용 공부 및 React 기초 다지기예상 모집인원 : 1 - 4명스터디 소개와 개설 이유 : 안녕하세요 3년차 프런트엔드 개발 프리렌서 활동을 하고 있는 개발자입니다. 우선 이 글을 작성하는 이유는 코딩입문자분들을 위해 무료로 강의 하는게 목적입니다. 주된 목적은 제가 공부를 하기 위함 + 저의 소심함을 극복하기 위해... 코딩입문자를 위한 교육이므로 어느정도 알고 계신분들은 비추합니다!지원자격: 1. 코딩입문자 2. 시간 여유가 충분하신 분 3. 취업준비생스터디 관련 주의사항 : 중도에 나가실분은 벌금을 받도록 하겠습니다.스터디에 지원할 수 있는 방법을 남겨주세요.여기로 들어오셔서 간단하게 소개 해주시면 될꺼 같습니다."
