,content
91,"안녕하세요!새해에 첫 시작을 스터디 모임을 통해서 시작하는 것은 어떠실까요? 🙂 전번에 했던 <자바 챌린지 스터디>, <배포 챌린지 스터디>, <리액트 스터디>를 잘 마무리하고이번에 새로 업그레이드해서 스터디를 계속 진행하고 있습니다! 이번엔 Docker 중급 스터디를 모집합니다!이전 배포 스터디에서 SpringBoot jar -> AWS EC2 서버에 배포, 그리고 Docker, Jenkins로 배포 자동화를 구축하는 작업을 하였는데요.아쉬운 부분이 RDBMS 로 진행하지 못한 부분이었습니다!그래서 요번 스터디는 DB를 중점으로 Docker로 설치하고 Application에 연동, 배포하는 작업까지 확장하는 스터디로 진행하고자 합니다.스터디 목표!🚀 SpringBoot REST API 구축하기SpringBoot와 JPA를 활용하여 REST API를 개발합니다.Docker 컨테이너를 사용하여 애플리케이션을 실행합니다.🐳 Docker로 RDBMS(mysql) 연결하기MySQL 데이터베이스를 Docker 컨테이너로 실행합니다.SpringBoot 애플리케이션과 MySQL을 연동합니다.💻 로컬에서 테스트하기!로컬 환경에서 애플리케이션을 확인하고 테스트합니다.☁ AWS EC2에 배포하기AWS EC2 인스턴스에 SpringBoot 애플리케이션과 더불어 MySQL까지 배포합니다.Plus) 🌐 AWS RDS와 Docker-compose를 사용하여 MySQL 설치AWS RDS를 설정하여 MySQL 데이터베이스를 호스팅합니다.Docker-compose를 사용하여 MySQL과 SpringBoot를 연동합니다. 과거 스터디를 하면서 스터디원들의 평가와 후기 👀그리고어떤방식 등으로 진행했는지는 카페를 개설해 이력을 남기고 있으니 거기서 한번 확인해보셔도 좋을 것 같습니다.https://cafe.naver.com/platformerwebdev제 스터디들의 큰 줄기는 ""이론 -> 실습"" 입니다.​스터디의 취지는 이 과정을 처음부터 끝까지 하여 배포 공부에 자신감을 가질 수 있 경험을 만들고자 함! 입니다.​기간: 딱 하루! 01/20시간: 토요일, 오후 5:00 ~ 8:00(3시간)장소: 강남역 스터디룸모집인원 : 오프라인 최대 5명 모집비용: 스터디 참여비용은 유료, (Notion 페이지 참조✅)관련 디테일한 내용은 Notion 페이지를 참고해주세요!https://www.notion.so/Docker-9c41f6af52854ee4abd99beca308bbc0?pvs=4​온라인 or 오프라인 모두 스터디 참가 가능합니다!참여하고 싶은 분들은 간단한 자기소개와 함께 1대1 오픈카톡방에 문의 주시기 바랍니다 :) 감사합니다!https://open.kakao.com/o/sGk3Mo3f"
92,"스터디 주제 : 정보처리기사 1트 합격스터디 목표 : 정보처리기사 필기/실기 한 번에 1트 합격예상 스터디 일정(횟수) : 주 1회(토요일 오후2시~6시), 사당역 부근 스터디카페예상 커리큘럼 간략히 : 일주일에 몇 시간을 꾸준히 자격증 취득에 투자하여 1회에 한 번에 합격할 수 있도록 하고자 함. 필수로 암기해야 하는 부분(38개)를 파트를 나눠 매주 시험보고, 남은 시간은 각자 정처기 혹은 관련 직무 공부를 하면 됩니다. 이를 통해 CS면접 대비까지 자연스럽게 하고자 합니다.예상 모집인원 : 1명 충원스터디 소개와 개설 이유 : 정처기 시험에 한 번 떨어졌는데, 대충하면 안 된다고 생각하고 열심히 하고자 해서 스터디를 만들었습니다. 또한, 비슷한 직무의 사람들과 함께 공부하면서 시너지를 얻고 싶어요. 동료 개발자 혹은 취준생으로서 같이 성장하고자 합니다. 좋은 인연이 됐음 좋겠습니다. 공부 분위기는 제가 최대한 좋게 만들게요.스터디 관련 주의사항 : 시간 약속 잘 지키지 않는 분, 열심히 하지 않는 분 사절.스터디 지원 방법 : https://open.kakao.com/o/s8yLGbDf"
93,"나만의 독보적인 포트폴리오를 만들고 싶다면?단기간에 프로젝트 A to Z를 경험하고 싶다면?타 직군과 소통하며 협업을 경험하고 싶다면? 위와 같은 고민을 하고 있다면 지금 당장 ‘스위프 3’기에 지원하세요!완벽하게 취.뽀. 하고 싶은 대학생&취준생&주니어 모두 환영! (비전공자도 환영🙌) 📢 [스위프란?]스위프는 기획자, 디자이너, 개발자가 한 팀으로 웹개발 단기 프로젝트(6주)를 경험하고 성장할 수 있는 기회를 제공합니다! 스위프를 통해 나와 맞는 팀원과 함께 프로젝트의 전 과정을 경험하고, 나만의 차별화 된 포트폴리오를 만들 수 있어요! ⭐ [참가 혜택]1. 체계적으로 협업할 수 있도록 스위프 전용 협업 툴 지원!2. 초보자도 쉽게 프로젝트를 진행할 수 있는 가이드라인 및 템플릿 제공!3. 복잡한 과정 없이 GitHub 연동만으로 쉽고 빠른 웹 호스팅 지원!4. 포트폴리오로 활용할 수 있도록 프로젝트 결과물 보존!→ 자세히 알아보기 https://swyg.oopy.io/swyp/benefit 🙌🏻 [모집 대상]- 아이디어 기획 경험이 한 번이라도 있는 기획자,디자인 툴 하나라도 사용해 본 디자이너,프로그래밍 언어를 하나라도 공부해 본 개발자, 모두 환영해요!- 한 번도 사이드 프로젝트 해본 적 ‘없’는 사람? 오히려 좋아요!- 경험이 부족해도 포트폴리오가 없어도 괜찮아요. 당신의 의지와 열정이면 충분해요! 🔥 [참가비]- “단돈 69,000원!”참가비 169,000원 (정가 250,000원)수료 시 현금 리워드(10만원) 증정 📅 [일정]- 지원 마감 : 1/21(일)- 합격자 안내 : 1/22(월) 20:00- 팀 빌딩 : 1/23(화)~1/25(목)- 킥오프 미팅 : 1/27(토) 10:00- 프로젝트 시작 : 1/29(월)- 프로젝트 발표 및 네트워킹 행사 : 2024/3/23(토)※ 세부 일정은 합격자에 한해 일괄 안내 예정 📌 [지원 방법]신청서 작성 https://swyp.softr.app 🙋 [문의]Contact : https://open.kakao.com/o/sgTUNmUdEmail : shlee@swyg.im 👉 스위그(SWYG)에 대해 더 알고 싶다면?홈페이지 https://www.swygbro.com인스타그램 https://www.instagram.com/swyg_official"
94,"[개발 스터디 모집 내용 예시]스터디 주제 : UXUI 피그마 figma 스터디스터디 목표 : 피그마 다루기예상 스터디 일정(횟수) :주 1회예상 커리큘럼 간략히 : 유튜브나 온라인 강의로 피그마 스터디예상 모집인원 : 5명스터디 소개와 개설 이유 : 웹디자이너, 프론트엔드 개발자에게도 유용한 피그마 함께 공부해요!스터디 관련 주의사항 : 스터디에 지원할 수 있는 방법을 남겨주세요. 😀 카카오톡 ID : yeonhello1"
95,"나만의 독보적인 포트폴리오를 만들고 싶다면?단기간에 프로젝트 A to Z를 경험하고 싶다면?타 직군과 소통하며 협업을 경험하고 싶다면? 위와 같은 고민을 하고 있다면 지금 당장 ‘스위프 3’기에 지원하세요!완벽하게 취.뽀. 하고 싶은 대학생&취준생&주니어 모두 환영! (비전공자도 환영🙌) 📢 [스위프란?]스위프는 기획자, 디자이너, 개발자가 한 팀으로 웹개발 단기 프로젝트(6주)를 경험하고 성장할 수 있는 기회를 제공합니다! 스위프를 통해 나와 맞는 팀원과 함께 프로젝트의 전 과정을 경험하고, 나만의 차별화 된 포트폴리오를 만들 수 있어요! ⭐ [참가 혜택]1. 체계적으로 협업할 수 있도록 스위프 전용 협업 툴 지원!2. 초보자도 쉽게 프로젝트를 진행할 수 있는 가이드라인 및 템플릿 제공!3. 복잡한 과정 없이 GitHub 연동만으로 쉽고 빠른 웹 호스팅 지원!4. 포트폴리오로 활용할 수 있도록 프로젝트 결과물 보존!→ 자세히 알아보기 https://swyg.oopy.io/swyp/benefit 🙌🏻 [모집 대상]- 아이디어 기획 경험이 한 번이라도 있는 기획자,디자인 툴 하나라도 사용해 본 디자이너,프로그래밍 언어를 하나라도 공부해 본 개발자, 모두 환영해요!- 한 번도 사이드 프로젝트 해본 적 ‘없’는 사람? 오히려 좋아요!- 경험이 부족해도 포트폴리오가 없어도 괜찮아요. 당신의 의지와 열정이면 충분해요! 🔥 [참가비]- “단돈 69,000원!”참가비 169,000원 (정가 250,000원)수료 시 현금 리워드(10만원) 증정 📅 [일정]- 지원 마감 : 1/21(일)- 합격자 안내 : 1/22(월) 20:00- 팀 빌딩 : 1/23(화)~1/25(목)- 킥오프 미팅 : 1/27(토) 10:00- 프로젝트 시작 : 1/29(월)- 프로젝트 발표 및 네트워킹 행사 : 2024/3/23(토)※ 세부 일정은 합격자에 한해 일괄 안내 예정 📌 [지원 방법]신청서 작성 https://swyp.softr.app 🙋 [문의]Contact : https://open.kakao.com/o/sgTUNmUdEmail : shlee@swyg.im 👉 스위그(SWYG)에 대해 더 알고 싶다면?홈페이지 https://www.swygbro.com인스타그램 https://www.instagram.com/swyg_official"
96,"스터디 주제 : 리액트 새로운 공식 문서 1회독예상 스터디 일정(횟수) : 주 1회 수요일 오후 7시, 종로, 오프라인, 약 2시간예상 커리큘럼 간략히챕터 순서대로 일주일에 한챕터씩 숙제 및 발표 준비를 해옵니다. 모임 때 본인이 맡은 파트를 발표하고 질문 및 토론을 할 예정입니다.숙제본인 파트 정리해서 블로그 또는 깃헙에 올리기예제 코드 풀이를 깃헙에 올리기발표준비선택사항 : 다른분들의 예제 코드 보고 리뷰해주기예상 모집인원 : 1명 (5분이 모여 있습니다!)스터디 소개와 개설 이유리액트에 생각보다 다양한 hook 들이 있다는 것과, 리액트 팀이 권장하는 리액트 사용 방법을 익히기 위해 스터디를 개설하게 되었습니다.열심히, 끝까지 해주실 분이라면 언제든지 환영입니다~~스터디 관련 주의사항스터디 참여율을 확인하기 위해 사전과제가 있습니다!불참, 숙제 미제출, 지각 시 벌금 있습니다! 스터디에 지원할 수 있는 방법을 남겨주세요. (이메일, 카카오 오픈채팅방, 구글폼 등.)https://open.kakao.com/o/sNYLmqLf"
97,"[개발 스터디 모집 내용 예시]스터디 주제 : 삼성역, 코엑스 웹개발 모각코스터디 목표 : 퇴근 후 모여 자기전까지 모각코 예상 스터디 일정(횟수) : 일단 화,수로 시작예상 커리큘럼 간략히 :예상 모집인원 : 6스터디 소개와 개설 이유스터디 관련 주의사항 :스터디에 지원할 수 있는 방법을 남겨주세요. (이메일, 카카오 오픈채팅방, 구글폼 등.)댓글 남겨주시고 오픈채팅방 들어오시면 됩니다.https://open.kakao.com/o/gpr1kZ0f 비번 0001"
98,"[개발 스터디 모집 내용 예시]스터디 주제 : 온라인 코딩테스트 스터디 예상 스터디 일정(횟수) : 주 1-2회 예상 커리큘럼: 인프런 하루코딩님의 강의 Do it! 알고리즘 코딩테스트 with JAVA를 한 주제씩 각자 시청하고 그 주제에 맞는 문제를 몇 개 선정한 후 서로 풀이한 내용을 공유 및 토론하는 방식으로 진행할 예정입니다. 예상 모집인원 : 5~6명 스터디에 지원할 수 있는 방법을 남겨주세요. (이메일, 카카오 오픈채팅방, 구글폼 등.) : https://open.kakao.com/o/sQce0a3f"
99,"안녕하세요 주말 오후에 카페에 같이 모여서개발 관련 공부하실 분들 모집합니다~각자 하고 싶은 공부 + 개발 관련 정보 공유 하면 좋을거 같아요 ㅎ장소는 정발산역 근처 카페가 될 것 같습니당대학생, 취준생, 직장인 분들 모두 환영입니다!부담없이 오실 수 있는 일산러분들 환영입니다~궁금하신 사항은 오픈카톡으로 질문주세요~https://open.kakao.com/o/gDl5282f"
100,"나만의 독보적인 포트폴리오를 만들고 싶다면?단기간에 프로젝트 A to Z를 경험하고 싶다면?타 직군과 소통하며 협업을 경험하고 싶다면? 위와 같은 고민을 하고 있다면 지금 당장 ‘스위프 3’기에 지원하세요!완벽하게 취.뽀. 하고 싶은 대학생&취준생&주니어 모두 환영! (비전공자도 환영🙌) 📢 [스위프란?]스위프는 기획자, 디자이너, 개발자가 한 팀으로 웹개발 단기 프로젝트(6주)를 경험하고 성장할 수 있는 기회를 제공합니다! 스위프를 통해 나와 맞는 팀원과 함께 프로젝트의 전 과정을 경험하고, 나만의 차별화 된 포트폴리오를 만들 수 있어요! ⭐ [참가 혜택]1. 체계적으로 협업할 수 있도록 스위프 전용 협업 툴 지원!2. 초보자도 쉽게 프로젝트를 진행할 수 있는 가이드라인 및 템플릿 제공!3. 복잡한 과정 없이 GitHub 연동만으로 쉽고 빠른 웹 호스팅 지원!4. 포트폴리오로 활용할 수 있도록 프로젝트 결과물 보존!→ 자세히 알아보기 https://swyg.oopy.io/swyp/benefit 🙌🏻 [모집 대상]- 아이디어 기획 경험이 한 번이라도 있는 기획자,디자인 툴 하나라도 사용해 본 디자이너,프로그래밍 언어를 하나라도 공부해 본 개발자, 모두 환영해요!- 한 번도 사이드 프로젝트 해본 적 ‘없’는 사람? 오히려 좋아요!- 경험이 부족해도 포트폴리오가 없어도 괜찮아요. 당신의 의지와 열정이면 충분해요! 🔥 [참가비]- “단돈 69,000원!”참가비 169,000원 (정가 250,000원)수료 시 현금 리워드(10만원) 증정 📅 [일정]- 지원 마감 : 1/21(일)- 합격자 안내 : 1/22(월) 20:00- 팀 빌딩 : 1/23(화)~1/25(목)- 킥오프 미팅 : 1/27(토) 10:00- 프로젝트 시작 : 1/29(월)- 프로젝트 발표 및 네트워킹 행사 : 2024/3/23(토)※ 세부 일정은 합격자에 한해 일괄 안내 예정 📌 [지원 방법]신청서 작성 https://swyp.softr.app 🙋 [문의]Contact : https://open.kakao.com/o/sgTUNmUdEmail : shlee@swyg.im 👉 스위그(SWYG)에 대해 더 알고 싶다면?홈페이지 https://www.swygbro.com인스타그램 https://www.instagram.com/swyg_official"
101,"<도커로 배우는 애플리케이션 관리 스터디>안녕하세요, 볼타코퍼레이션 CTO 진태양입니다.이 스터디는 단순히 책을 읽고 서로 생각을 공유하는게 아닌, 각자 학습한 부분과 의견을 공유한 뒤 제가 도커와 관련된 오프라인 세션을 하는 방식으로 진행됩니다.오프라인 세션에서는 주로 도커와 컨테이너 관련 개념 전달, 실제 사용 사례 등을 다룹니다. 아래 내용을 모두 확인해보신 후, 관심있으시다면 신청해주세요.  모집 일정: ~ 1월 17일(수)인원: 스터디장 포함 6명(MAX 8명)일정: 1월 21일(일) 오리엔테이션부터 약 10주장소: 온라인(단톡방) / 오프라인(강남역) 스터디 전체 소개 및 신청 안내https://weekly-academy.notion.site/325ec757bb5541d79144666dd27b9e3f?pvs=4진행 방법“도커 교과서” 책을 읽고, 각자 정리하여 격주 단위 공유 및 스터디장의 세션 진행오리엔테이션: 1월 21일(일) 15:00 / 오프라인(강남역)정리한 글 공유: 격주 금요일 밤까지 / 온라인(단톡방)2/2(금) 2/16(금) 3/1(금) 3/15(금) ...오프라인 세션: 격주 일요일 15:00 / 오프라인(강남역)2/4(일) 2/18(일) 3/3(일) 3/17(일) ...전체 기간은 오리엔테이션 결과에 따라 변동될 수 있습니다.예) 1주 단위로 진행에 따른 기간 단축예) 더 많은 내용을 다루기 위해 기간 연장참가 보증금 관련 안내참가 보증금: 1만원 / 스터디 끝까지 참가 시 반환 / 1회 이상 불참 시 다른 참가자에게 1/n 분배스터디 참가 기준: 격주 금요일 밤까지 정리한 글 공유오프라인 세션 참가의 경우 필수는 아닙니다. 참가 대상이미 엔지니어로 일하고 있으신 직장인분들에게 추천합니다.Next.js 등 서버 사이드 프레임워크를 학습하며 Docker를 접했지만 이에 대한 경험과 지식이 부족하신 프론트엔드 엔지니어평소 Docker를 이용하여 애플리케이션을 배포하고 있지만 Docker에 대한 경험과 지식이 부족하신 백엔드 엔지니어Docker를 포함한 전반적인 IT지식이 필요한 주니어 개발자 주요 스터디 내용기본 개념: 가상화, 컨테이너, 레지스트리, 이미지 빌드, 컨테이너 애플리케이션 구성심화 개념: 네트워크, 볼륨실무: 레이어 관리, 캐싱, 3 Tier 구성, 개발환경(IntelliJ, VSCode)의 컨테이너 활용활용: Docker Compose, GitHub Actions실전: AWS Amplify를 이용한 Next.js 앱 배포 기대 결과컨테이너의 동작 원리와 전반적인 생태계 이해실무에서 컨테이너를 적용할 수 있는 부분과 적용 방법 습득"
102,"스터디 목표코어 자바스크립트 (저자 정재남) 한 챕터씩 읽어서, 1회독 하기 (n회독도 가능) 예상 스터디 일정(횟수)주 1~3회(본인이 읽은 분량에 따라 다름) / 평일에 빠진 날은 주말로 채우기 가능  예상 커리큘럼 간략히코어 자바스크립트를 한 챕터씩 읽습니다.양이 많거나 몸상태에 따라 챕터의 1/2, 1/3 (최대 3분할까지 가능)까지 쪼개서 읽을 수 있습니다.(이에 따라 주 1회만 올려도 되고, 주 2~3회까지 올려도 됩니다.)계획한 날짜에 못할 때에는 주말이나 다른 요일을 이용해서 올릴 수 있습니다.(다만 매주 일요일 오후까진 돌아오는 주의 목표 계획을 적어야합니다)해당 파트 요약 + 새로 알게 된 사실 등을 적을 건데, 디스코드 채널에 양식을 만들어 둘 것입니다. 예상 모집인원3-4명 스터디 관련 주의사항각자 읽을 파트는 어디서부터 시작하든, 하루에 얼마나 읽든 상관하지 않습니다.  한 주에 한 챕터를 읽어서 최소 1회독을 하는 스터디입니다.책이 그렇게 길지 않습니다.벌금 없이 자율적으로 하는 만큼, 더욱 학습에 성실하신 분과 함께하고 싶습니다. 지원방법jsparty0311@gmail.com메일로 간단한 자기소개와 함께 자바스크립트 학습을 어디까지 어떤식으로 해왔는지 적어주세요.(평소 참여 중인 스터디나 성실도를 볼 수 있는 지표를 보여주셔도 좋습니다.)감사합니다. 😊(돌아오는 월요일부터 스터디 시작 예정입니다. 메일 주신 분들께 주말 안으로 답장 드리겠습니다!)"
103,📢 1월 단기 스터디를 모집합니다주제는 리액트로 로그인 구현하기 입니다저는 파이어베이스도 사용할 예정이지만 리액트로 로그인 구현하는 틀에서 벗어나지만 않으면 자유롭게 완성만 하면됩니다. ⛳ 룰1/29 (월) 까지 깃허브 제출하고 서로 코드리뷰해요1/31 (수) 8시 30분에 구글 밋으로 만나서 어떻게 만들었는지 이야기해요그리고 해산!모든 팀원이 정해진 기간보다 빨리 완성했다면 팀원 동의하에 해산일을 앞당길 수 있어요 📮 지원방법오픈 카카오톡방으로 들어와주세요 !어떻게든 스스로 구현만 해내면 됩니다1월에 작더라도 무언가 해내고 싶은분 참여해주세요 😎저 포함 3명이서 진행되고 한자리 남았습니다 !https://open.kakao.com/o/gEnSdAWf 🙏 바라는점스터디 내용이외에도 해산 전까지 열심히 사는 모습 서로 보여주면서 동기부여하고 싶어요저는 월-목 퇴근 후 카페가서 공부하는 모습 보여드릴께요🫨
104,"안녕하세요, IT 개발 관련 공동 프로젝트 및 자율 스터디를 진행할 예정입니다. (영어, 한국어)현재까지 모집된 인원은 Junior Level로 구성된 FE/BE 개발자 세명이고, 영어는 IT 필드와 떼어놓을 수 없는 숙명이기에… 일부 스터디는 영어로 진행하려 합니다. ( 언어에 대한 부분은 부담 갖지 않으셨으면 합니다. 다만 영어 스터디는 이미 결정된 사항이라 참여는 부탁드리며 어느 정도 의사 통은 필요합니다 :)  )  <Plan>Weekly Meeting (5h) - 주 마다 상의 하에 토요일 또는 일요일 유동적으로 결정됩니다.Project (1h) : Brain Storming ( 프로젝트 외에 논의가 필요한 사항 & 티타임 - 한국어 진행 )Process Sharing (2h) : weekly 진행하였던 작업 내용 공유 및 Q&A ( 영어 진행 )자율 스터디 및 프로젝트 작업 시간 (3h)   <모집 인원>UX / UI : 디자인 및 기획 사이드에서 기획 디자인 내용을 서로 공유하시며 진행하면 좋겠다라는 의견 하에 두 분을 모집하는 것으로 결정하였습니다. Developer : FE / BE FullStack 가능하신 Senior Level 개발자 한 분을 더 모시려 합니다. 언어는 Typescript (JS), Python (AI) 두 가지 사용 예정이며 상호 간에 자유롭고 활발한 의견 수용이 가능하신 분이라면 환영입니다. 총 인원 수는 5-6 명 예정입니다.  <모집 조건> Weekly 미팅을 기본으로 스터디가 스케줄링 될 예정이고, 너무 빈번하게 불참하시는 경우 참여가 불가능합니다ㅠ현업 경험이 있으시고, 상호 포트폴리오 공유가 가능하신 분 ( 참여 의사를 결정하시기 이전에 저희 포트폴리오도 당연히 공유드릴 예정입니다. Entry level이셔도 괜찮습니다. )  <Location>강남역 소재의 공유 오피스에서 진행 예정입니다. ( 아직 픽스 되지 않았고, 차주부터 우선 Sparkplus 이용 예정입니다. )쉐어 라운지에서 모임이 있을 예정이라, 사비 지출이 불가피합니다. 상호간에 안면이 없는 상태에서 스터디에 열정과 시간을 투자하실 분을 찾고자 하다보니 불가피하게 결정된 내용입니다. 불편하게 생각하시지 않으셨으면 합니다.오프라인 미팅이 있는 날짜만 일일권 결재하셔도 괜찮습니다. 현업 퇴근 후, 개인 작업을 하시고 싶으신 분들은 자율적으로 한 달씩 라운지 이용 예정입니다. 각자 책임감과 목표를 가지고 능동적으로 참여하는 스터디가 되었으면 합니다 🙂 참여하고자 하시는 분은 간단한 소개 및 메세지 보내주시면 됩니다.https://open.kakao.com/o/sk2HeX2f 감사합니다!"
105,"[개발 스터디 모집 내용 예시]스터디 주제 : 취업스터디스터디 목표 : 취업예상 스터디 일정(횟수) : 주 3회 (2회 오프라인 모임/ 1회 온라인)예상 커리큘럼 간략히 : 코테/면접/취업 포트폴리오까지 다 한번에 하기.예상 모집인원 : 5명 (현재 4/5)스터디 소개와 개설 이유 : 안녕하세요. 제가 이 스터디를 모집하게 된 이유는 혼자서 취업에 필요한 것들을 준비하는데 어려움이 있어서 함께 서로 독려하며 취업까지 함께 하기 위함입니다. 취업용 포트폴리오를 만드는 것과 동시에 코테와 면접을 같이 준비하기 위해 인원을 모집합니다. 저 또한 경력없는 취준생입니다. 아래 오픈 채팅방 링크 남겨놓았으니 카톡으로 편하게 연락 주세요.스터디 관련 주의사항 : 이 스터디는 단순 코테/면접을 넘어서 포폴을 위해 프로젝트 1개를 진행하는 것을 목표로 하고 있습니다. ""주 2회 오전에 오프라인 스터디 참여가 가능한분/프로젝트를 진행할 의사가 있는 분"" 두 가지 모두 해당하시는 분들이 지원해주시면 좋을 것 같습니다. 그리고 ""백엔드 포지션""을 모집중이니 참고 부탁드립니다.프로젝트 관련: 현재 기획만 되어있는 상태입니다. 프로젝트 주제는 부동산 데이터를 분석한 것과 매매에 관한 서비스를 제공하는 플랫폼을 계획하였습니다. 프로젝트 기한은 4~5주 입니다. 프로젝트 종료 후에는 코테와 면접 위주로 스터디를 진행할 계획입니다.스터디에 지원할 수 있는 방법을 남겨주세요. (이메일, 카카오 오픈채팅방, 구글폼 등.) : https://open.kakao.com/o/gJObyu0f"
106,"공모전 수상을 목표로, 열정적이고 유능한 데이터 분석가를 찾아요! 함께 성공을 이루어 나갈 동료들의 지원을 기다립니다. 지원자격 :공모전 경험이 있거나 데이터 분석에 능숙하신 분, 또는 기획서 및 PPT 제작에 숙력된 분을 모집합니다. 팀장 소개 : 부산에서 AI데이터 분석 업루를 담당하고 있어요! 분야에 대한 지식과 실무 경험을 바탕으로 팀을 이끌고 있습니다.  관심 있으신 분은 메일 또는 오픈 채팅으로 간단하게 지원해주세요.오픈 카카오톡 : https://open.kakao.com/o/sELYXS2f메일 : wnsgud4553@naver.com"
